{
  "schemaVersion": "1.0",
  "generatedAt": "2026-10-09T09:55:58.823Z",
  "registryUrl": "https://github.com/Cantata-Communication-Solutions/haptique-kitchen-registry",
  "packages": [
    {
      "id": "com.haptique.community.byd-vehicle",
      "name": "BYD Vehicle",
      "type": "driver",
      "version": "0.1.0-beta.1",
      "summary": "BYD vehicle status and supported controls for community testing.",
      "description": "Developer beta. Source and local-upload ZIP are available in the source repository. Real-vehicle testing and Haptique review/signing are required before an installable Kitchen release. Location sharing is off by default.",
      "author": "Haptique community",
      "trustLevel": "community",
      "tags": [
        "byd",
        "vehicle",
        "ev",
        "cloud"
      ],
      "deviceClass": "sensor",
      "capabilities": [
        "device_discovery",
        "state_updates",
        "telemetry",
        "lock",
        "climate"
      ],
      "permissions": [
        "cloud_access",
        "device_control",
        "credential_storage",
        "background_service",
        "local_network"
      ],
      "compatibility": {
        "haptiqueOS": ">=1.2.0-rc.3"
      },
      "source": {
        "repo": "https://github.com/Cantata-Communication-Solutions/haptique-byd-vehicle",
        "docs": "https://github.com/Cantata-Communication-Solutions/haptique-byd-vehicle#readme",
        "issues": "https://github.com/Cantata-Communication-Solutions/haptique-byd-vehicle/issues"
      },
      "driver": {
        "key": "BYD_VEHICLE",
        "logicalDeviceUi": {
          "defaultLayout": "sensor",
          "primaryControls": [
            "refresh_state"
          ]
        }
      }
    },
    {
      "id": "com.haptique.examples.denon-avr",
      "name": "Denon AVR Example",
      "type": "driver",
      "version": "0.1.0",
      "summary": "Example Kitchen listing for an AV receiver driver that renders through the OS Logical Device UI contract.",
      "description": "This source-only example demonstrates the required metadata for a Kitchen driver listing. Real installable drivers should add artifact.downloadUrl that points to a release ZIP containing a Haptique driver manifest and local driver source.",
      "author": "Haptique",
      "trustLevel": "community",
      "tags": [
        "avr",
        "audio",
        "receiver"
      ],
      "deviceClass": "av_receiver",
      "capabilities": [
        "power",
        "volume",
        "mute",
        "input_select"
      ],
      "permissions": [
        "local_network",
        "device_control"
      ],
      "compatibility": {
        "haptiqueOS": ">=1.0.6"
      },
      "source": {
        "repo": "https://github.com/Cantata-Communication-Solutions/haptique-kitchen-registry",
        "docs": "https://github.com/Cantata-Communication-Solutions/haptique-kitchen-registry/wiki"
      },
      "driver": {
        "key": "DENON_AVR_EXAMPLE",
        "logicalDeviceUi": {
          "defaultLayout": "av_receiver",
          "primaryControls": [
            "power",
            "volume",
            "mute",
            "input_select"
          ]
        }
      }
    }
  ],
  "blocked": [],
  "deprecated": []
}
